subject,content
neither,"This will probably get lost in the chatter, but I hope that at least the OP sees it. In my experience, generally speaking, other Redditors are cool for the most part, though I tend to stick mostly to smaller subreddits that relate to topics I'm interested in. The comments or posts that I've made that have been the most severely downvoted have mostly been ones that I've made while either drunk and belligerent or pissed off with an axe to grind - meaning I pretty much deserved those downvotes. Your gender shouldn't really matter on here, but sad to say, it often does get pulled into a debate due to biases that people have, whether consciously or not. I'm likely guilty of it myself occasionally, though I try not to. Of course, in debates that revolve around gender (such as in /r/mensrights or /r/2xChromosomes [I think that's right]), it's pretty much impossible to ignore gender bias, at least to some extent. Oddly enough, the highest upvoted comments I've had, until recently, have mostly been pun comments or jokes playing off of the topic or another comment. Recently, I've been getting a lot of positive response to posts regarding the new TSA procedures, as I've identified myself as an airport security employee, and redditors love getting an inside perspective - though most of the positive response has been in /r/OperationGrabAss and /r/libertarian, where I'm speaking to a sympathetic community. Overall, I see the Reddit community as a bunch of strong-minded and strong-willed (and often highly opinionated) individuals who are largely good people with other's best interests at heart (the Donor's Choose contributions, the Toy Store free for all for the terminally ill little girl that was harshly teased by neighbors, and all of the various ""my [family member/neighbor/friend/etc] has [hardship] and things are tough - Do what you do best"" posts). This community never fails to warm my heart on a regular basis. That said, we're also a community of people who seem to love debate, and are often passionate and emotional about the issues we discuss, and don't always follow reason, even if most debates are reasonable. Honestly, even though I've had my bad experiences here (and I'm sure most people have), I keep coming back because this is simply a great group of people on the whole. TL;DR: Redditors rock, even in light of the few that can be assholes."
insult,"Have another, you crybaby."
non-insult,"My job requires lots of interstate driving, often against tight deadlines. Speeding is simply part of the job, to the point that my company pays half our fines and gives us days off if wee need to take defensive driving courses to get points off our licenses. our 'company cars' are midsized SUV's too which most of us have added push bars and off-road lighting- not because we go off-roading, simply to intimidate slower drivers out of the way. having a cupholder full of marbles and ball-bearings to sling at the real assholes out there helps too."
non-insult,> This is the real world Yes in the real world people are assholes. Dont let them get you down.
non-insult,"Both those subreddits are probably the worst of reddit. Full of smug, hateful, condescending, close-minded douchebags like the OP is talking about. You excepted, of course."
non-insult,I agree. There are a lot of inappropriate assholes on here.
insult,Upvote for writing REPUBLICANS ARE SUCH STUPID IDIOT MORONS HAHAHAHA!!!!111!1
non-insult,"Was the drive damaged when you sent it in? Or was it just file system damage? If it was just file system damage, you could go after him for willfully destroying not only your property, but your data - and then trying to extort money from you for its return. Nail the fucker to a wall. As an IT person I live in constant fear of cocking up and losing data; and certainly, if something went wrong I'd bend over backwards to fix it. Further, my boss pays quite a bit every month in insurance just in case the worst ever happens. If he hasn't taken those steps, then he is a cowboy and should be sued into oblivion before he rips someone else off."
neither,"No shit, that order tracker app is the shiz man. Nothing like knowing exactly when that bitch hits the road."
insult,Fuck that bitch.
non-insult,"If life itself was actually just a huge circle-jerk, everyone would be happy because of the orgasms."
insult,"lol. You moron, it's a bomb, it's a weapon - and you've even got its laughable military euphemism wrong: it's the *Military Effect Test*. I even gave you the link to know all this. You need to try and learn - you can't expect to be spoon fed all the time."
non-insult,Seconded. I cried like a little bitch at the end of that film.
insult,Sissy.
non-insult,"To the contrary, it guarantees the highest quality pussy."
neither,"A few years ago me and a mate (who were looking a bit rough after a night out - long story, lol) asked this nice looking fellow the time, as we didnt want to miss our train home. The rude bastard buggered off and we missed our train, ruining Christmas for all."
non-insult,Brace for subsequent circle jerk thread.
insult,"Srsly, nobody gives a fuck!!! every few weeks some moron posts this shit.U dumb americans couldnt even make ur dogs go poop outside .jesus"
non-insult,"This will open a whole new world of liabilities for debt collectors. A common tactic that people who make a living dodging bills use is to claim to be dead. I worked as a collector for two and a half years and I felt heartless as hell doing it, but we were required to ask for a copy of the death certificate. I felt like a jerk asking for it, but it was amazing how many people managed to resurrect themselves by the next time we would call. The problem here is that if someone enters a person as dead, the collector will try to collect from friends, disclosing the debt to them. If a person is alive this is very much against the law. A lot of less-than-reputable agencies (like the one I worked for) is going to get their workers sued because of this (FYI, it's the collector that gets sued, not the agency, and less-than-reputable agencies purposely keep their collectors in the dark about the law)."
insult,"I'm the person OP asked. As are you. We're entitled to our opinions, and my opinion is that she's a bitch. But I'd still plow that shit."
insult,Can you put that in terms of McDonalds apple pies? I don't quite grasp what you're saying. EDIT: I guess you douchebags don't remember this gem from the Daily Show.
insult,"> People would come over, and coo at my boy, the girl, and then quietly passover the leprechaun. Wow. Those people are assholes."
insult,Stop being such a pussy.
insult,Downvote for being a shithead.
non-insult,"Yeah, I agree. I don't contribute much, but I find myself being a jerk on here occasionally. I also don't really get into clever puns & memes."
non-insult,"Dude, I've been to Jamaica. I don't like making blanket statements like this but those fuckers *hate* white people. *they're* the ones being racist."
non-insult,Eventually these same scumbag cops who have no regard for the constitution or civil liberties will be kicking in your door asking questions because now you are a terrorist.
non-insult,Those Korean champions pull mad pussy.
non-insult,"I'm sorry your girlfriend is a flake. you did not go into detail about how you go together, but the brief description you gave makes her sound indecisive and flaky. This thing with getting mad at you for something you did in a dream is stupid. If she wants to be mad at someone she should be mad at herself seeing as her own subconscious made the dream. I would say that for now, do nothing. Let her respond to the text and give her some space. If she does start being bitch at you because of this, dump her. Life is too short to spend time fighting over make believe things. She has no right to be snarky when you did nothing, and if she thinks her 'cute' text warning you about the dream excuses bad behavior she is delusional. If she is like this about things you didn't even do, lord help ya when you really piss her off. In my opinion, This relationship is headed toward communication problems and huge yelling fights. edit: spelling."
non-insult,All of these can be researched and learned via the net. Here is a start. Book learning is not hands on. Takes time and experience to be the go to guy for everything. Trouble is once you are there they hire someone for half your salary and bitch about the shitty service lol... By all means create yourself a small network lab so you can get to know the UI and options. Fixing home computers is not a resume for corporate networks. Get your certs your company should reimburse you for them. Hell you can buy certs online lol...
insult,"Shut up, you wimp."
insult,shut up you whiny faggot....this shit shouldn't bother you.
neither,"Take a look in the mirror. Like what you see most of the time? I hope so. Most people are fundamentally good. Now imagine yourself in a stadium, looking in the mirror. What you see is yourself, and half a million people looking in the mirror. Like what you see? Well, mostly you see you. But you also see a half million people. Some of them are beautiful. Some of them are horrifying. Most of them are nice and don't really care about you. Some of them are downright evil and they *will* fuck with your shit just to do it. *Now imagine we're all using the same mirror.* That's Reddit. * * * The Internet is a rough place. The more anonymous you can be, the rougher you can be. Now that we're pushing a half-million users, there isn't a whole lot to distinguish Reddit from /b/, other than the clever-or-stupid usernames. And it's no secret that the collective intelligence of any group is inversely proportional to its size. As a result, the bigger subreddits tend to be completely worthless for discourse. It's gotten worse lately as well; it used to be trolls would argue with you. Now they'll just downvote you. The inverse of this is that the smaller a group, the less anonymous it tends to be. You see the same names over and over and things get less anonymous. The less anonymous places are, the nicer they tend to be. Not finding the ""community"" ""very nice?"" Make your community smaller. I mean, lemme break this down. You're posting using a throwaway... in a subreddit with 328,000 subscribers... to talk shit about people. That's pretty much part of the problem, isn't it? You marvel that this one post has more karma than your regular account, but the fact of the matter is, you're participating in (and encouraging) the exact behavior you despise - anonymous, prejudiced slagging. There's nothing ""ironic"" about that, Alanis. You're feeding the circlejerk and the jerks are circling. Compare and contrast: Here's the exact same gripe, in a forum less than 1/10th the size, from a month ago. Which has better discourse? That person didn't post under a throwaway, either. Why did you, by the way? If 600 upvotes is more than you've managed to amass, you, too are one of the anonymous hordes with nothing to lose. Could it be that it's just easier to say nasty shit when there's nothing riding on it? Reddit.com has more uniques and more imprints than salon.com and huffingtonpost.com *combined.* You're in the big water now, missy. Do you despair of the idiocy of Youtube comments? Does Yahoo! Answers curl your toes? There are as many dedicated posters here as there are there... and I guarantee you things are higher quality 'round these parts. If you focus on the bad, the bad is what you see. If you focus on the good, the good is what you see. *What do you want to see in the mirror?* You've heard the saw about the two wolves, right? Inside every young brave there's a good wolf and a bad wolf? Which one wins? The one you feed, right? By posting anonymously in Askreddit and slagging everyone indiscriminately, *you're feeding the bad wolf.* Food for thought."
non-insult,"""Why is it that anyone driving faster than you is a maniac, and anyone slower than you is a moron?"" -George Carlin /not exactly relevant"
non-insult,Encourage her stupidity then bask in a world with one less moron.
non-insult,"I felt the same way when I started on reddit. Since you used a throwaway account I have no idea how long you have been a contributing member, but I found that I was more well received the more I contributed. Just like it takes practice to learn how to speak/argue/comment/contribute to any group, reddit takes some learning. I haven't been here for long compared to many other redditors (coming up on a year soon), but I know that I became more comfortable and more successful with posts and comments when I commented more. Also, there are assholes everywhere; reddit is no exception."
neither,"I agree. The Internet in general is not a very nice place, overall. There are tiny pockets of niceness here and there, but that's about all there is. Sad to say, but it's probably about all you can ever reasonably expect. I think a lot of people (myself included) would **love** to find a tight-knit Internet community that is friendly, inviting, and non-judgmental. But alas I think that's more of a pipe dream than anything. The closest I've come to that was a couple of WoW guilds, and in the pre-Internet days, a couple of old school BBSes - those were a lot of fun, but still suffered from the occasional jackass joining the group. But then I got burned out on WoW and quit, then got married, then had a kid, and now I have no time for WoW. So there went that. I tried setting up a small message board for myself and a few of my closest friends, but unfortunately my friends prefer to just Facebook everything. I personally don't like Facebook. I don't want to broadcast everything I say to everyone I ever knew, and most of the stuff my Facebook ""friends"" post on FB is garbage anyway. It always seems to devolve back to that whole ""talking more and more about less and less"" thing, which has been an oft-cited criticism of the ""digital age""."
non-insult,Because there are a lot of unattributed stories and quotes that say he's a big jerk.
non-insult,"This should be up top. Because whether or not this is true, it is still the feeling that one can get from an hour or less of browsing reddit. Redditors should be aware that they are making themselves look like jerks. Myself included."
non-insult,"yeah, I was kind of like ""wow, seattle is full of jerks."" but it is the internet, after all. hope his family is alright."
non-insult,Really though? The Boondocks are responsible for overuse of the word bitch? That train sailed many years before.
insult,"It went bang, you moron! It's a bomb. It's a weapon. It's whatever euphemism the military call it. Fact: U-233 has - and can be - made in to a bomb. lol. How stupid are you going to make yourself look in this thread?! :D"
non-insult,"Look, I know Depp is an awesome actor. He's been amazing in any number of rolls, including Pirates, but despite the deluge of expected downvotes, I gotta say, every time I read an interview or see him talk he just comes off as a pretentious wanker to me. >‰ÛÏI‰Ûªve had the honor and the pleasure and gift of having known Elizabeth Taylor for a number of years,‰Û� he says. Really Johnny? The honor, pleasure AND the gift? Okay... commence with the downvotes..."
insult,Yippee ki yay motherfucker.
insult,What a bunch of assholes.
non-insult,I can just see the fast and furious wankers getting hold of it and making even stupider cars.
insult,"The Op is a du,b bitch who likes to smell his own ass"
insult,"Giant, flying lizards. You moron!*"
neither,"This mother fucker is from new york city, not to mention most Texans I know are ready to hang most public officials."
insult,Because she wants you to be a man and stop acting like a nerdy fag. Douchebags don't have women problems.
non-insult,In what was is the United States going along with the will of the people? Our leaders describe Iran as a serious threat all the time.
non-insult,How have they been passive aggressive?
non-insult,I've read that the bulk of patients are those who have been or are in emotionally and/or physically or financially abusive relationships.
non-insult,"Of course not, why would you be so cruel? [](/troll ""problem?"")"
non-insult,Was she using her hands to hold on?
non-insult,Also known as Coffee Penis.
non-insult,Battle Toads nuff said
non-insult,nice wooden sword
non-insult,I'm far too stupid to do anything useful.
non-insult,"Right, but he just really attacked the guy and was trying to convert him from the get go. Usually he only pokes fun at them until they refuse treatment for religious reasons but this episode I felt like it he was trying to 'convert' him to atheism as soon as he walked into the door. It also ended with this 'well whatever works for you' resolution on the guys spiritual outlook and to me conveyed the message that being too spiritual was bad but still believing in God was a good thing."
non-insult,"I think a better move would be to look in to overclocking your cpu to 3.2 - 3.4 GHz. - clean out the dust first & make sure that the thermal grease is good, dont want to cook your cpu. After looking at the games, i dont see much in the sound options for the bitrate settings. The real bottle neck is the bus speed bewteen your cpu, ram & graphics card. Anouther way to check that it is the new sound things causing the slow down would be to disable your sound card & then run the game, if no improvement then it would not help by getting a sound card."
non-insult,Just gave them a call. They said they 'reset' my connection. Hopefully I'll be in for a nice surprise when I get home from work.
non-insult,"well im in school right now ( though id give crippleing debt a try for a while) but the job i had before was doing landscaping. i liked it, it was pretty cool to see the finished product you get to create. and another bonus was my boss was a stoner so i smoked at work like everyday. only thing that sucked was the pay ( i was making like barely enough to get me from paycheck to paycheck ) but it was worth it"
non-insult,I already shaved my V for Vagina
non-insult,">I never said ISLAM CAUZES ALL EVILZ but certainly you think that it never causes evil. I pretty much admitted that there are radical and extreme elements within Islam who are most definitely evil. The problem is that until the US started nurturing, funding, arming, training and disseminating them they existed mostly as ostracized and powerless fringe elements. Its a natural form of social control that exists in all societies. In Afghanistan for example, Mullah's traditionally used to be the butt of jokes. > Reading your posts you speak as if Islam based governments have never done evil and have been a bunch of pussies historically. Then you have trouble with reading and comprehension. >I dare you to admit to any flaws or is it rather convenient to bury your head in the sand and deflect to a scapegoat? I have already admitted that extreme and radical elements exist within the Muslim World. Radical and fundie elements exist within all communities and groups. The difference is that most of them aren't backed up by the world's only superpower."
non-insult,"I remember discussing this painting once. Apparently the original had Saturn's Phallus visible, for some reason that was significant."
non-insult,Not that I've been able to find. :/
non-insult,"""On the flip side, the developed north will seek a better accounting from China, India and other emerging economies of the south on what they're doing to slow the galloping growth of their greenhouse gas emissions."" If they're counting China and India among the developing countries then I'd like to know what share of their pollution is going into producing goods for the US that we have since stopped making ourselves. Plastic products exported to the US, and the emissions from their production, should really still be considered our pollution and not theirs."
non-insult,"Yeah, the music industry has a real shortage of attractive females."
non-insult,"Explain to yourself then why machine guns became illegal. Here's a few hints: Prohibition. Chicago. Al Capone. Tommy guns. Prohibition was repealed in the Depression. Why are machine guns still illegal? Here's a few more hints: Pot. Ecstasy. LSD. Oh, looks like Prohibition all over again. The federal government doesn't care for the citizenry's disregard of laws governing moral conduct, and doesn't like being outgunned when the matter comes to blows."
non-insult,"a certain demographic of men. putting it nicely I think because of the kind of site reddit is it attracts a statistically disproportionate number of men who are long term single against their own will (be it through lack of social skills, appearance or whatever). these tend to be the kind who consider themselves the ""nice guy"" because they dote on women they desire but reveal their true bitter mysoginy when their 'entitlement' to sex because of this nice behavior isn't met. put these people together behind the anonimity of a keyboard and its innevitable that they will vent this anti-female sentiment. I can assure you that the vast majority of well adjusted socially functioning men on this website are absolutely disgusted by the sexist bullshit that gets upvoted here, and we are abhored that these people create a negative impression for us all. I would say the same thing for the culture of casual racism on reddit."
non-insult,"no, you don't. I moved from one district to another and all they asked for was my school records from the previous school."
non-insult,you can drill a hole in the wall and go ethernet ! !
non-insult,"Problem with Lake Mead is there's a lot of lakelurks to watch out for. Also, cazadors are mean sonsabitches. Be careful out there."
non-insult,I welcome you to hang out in /r/trees. It is a very friendly group over there ;). We like all ents.
non-insult,"Man, I hate when that happens."
neither,You beautiful troll you!
non-insult,"yeah, they do with with various solutions depending on the branch. Redhat has their thing, so all redhat siblings do the same method, same with Debian. In windows, it up to the app developers to handle this. I view it as a business decision. There's a lot of bad programmers and they don't follow the suggestions MS publishes now. Sometimes that's good, sometimes it's bad. If MS was to say, you're app must be submitted or at least it'd dependency's, I don't think people would do it correctly. And really, what value does it provide to MS other than a money sink? Steam could do the same thing on it's own as well, it is a package distribution system (really just cdn, but it wouldn't take much more...). I wonder if Valve has done a cost benefit analysis to see if the cost of the bandwidth (of the redist type files) would cover the cost of development time + maintenance."
non-insult,"I did too, I put commas between sentences."
non-insult,I'm in. Should we form groups for a more hilarious effect?
non-insult,"Me and many others are not so much concerned about the immediate legal context of the case, as of the precedent that it establishes, and what it means for the nature of the relation between press and public in the US. The vaunted Fourth Estate and its freedom to publish information as it sees fit is protected by law in the United States. But if the press is willing to lie outright, then what good is it?"
non-insult,Someone tell Tyler Durden at Zerohedge about this.
non-insult,I almost believed that.
non-insult,By purchasing this game you personally killed a dolphin. --PETA
non-insult,No more than it is necessary to study fashion to notice that the emperor is naked. Credit to PZ Myers where credit is due.
non-insult,"Ooooooooh. Yeah, I agree with your decision completely."
non-insult,That's the Quadruple-S watchlist. https://secure.wikimedia.org/wikipedia/en/wiki/Secondary_Security_Screening_Selection
non-insult,If only he had removed that stray period :(
non-insult,pwnage
non-insult,here is a video showing the swivel http://www.youtube.com/watch?v=nR86bvFgLwk&feature=fvst Here is a video showing him use it http://www.youtube.com/watch?v=oLyPNLNMX9M&feature=channel Is it just me or at 1:12 in the second video when he is using the tablet does it not look very responsive? Idk it just looks laggy to me. Anyone else notice this?
insult,"Sorry, but this guy sounds like a whiny bitch..."
non-insult,TIL: Rooting doesn't mean fucking in America.
non-insult,I picked one up once and wiped out some guys with it. Seemed a bit powerful from that experience.
non-insult,Panera bread company for breakfast
non-insult,This is so lame...
non-insult,I couldnt upvote you more if I had all the arrows in the world...sigh... the pendulum always has to swing the other way- and we just have to be sharp about our science....
non-insult,That's not a real user :| http://www.reddit.com/user/ProbablyShittingOnYou/
non-insult,"Let's see. Amelia McDonell-Parry writes about advocating the RAPE OF MINORS (""21 guys we're ashamed to say we'd screw"" - 2 of them being minors). Then she gets dumped by her fiance. Then she constantly complains about not being able to find a man because all men suck. And now she has the nerve to talk about ""emotional cripples""? Maybe she should just write an article titled ""Irony"" and just put her picture in it."
non-insult,charge for your service = profit!
non-insult,"DSL here is 1.5mbps or 3mbps and you can order higher speeds most of the time. Sure its not the 15mbps that Comcast offers, but its a consistent speed that doesn't drop to 0mbps just because the kids next door run bittorrent all the time."
non-insult,My statistics were part of the 47.3% :-)
