subject,content
insult,"Ok... so you can't smack your kids on the bum for being bad. What then? Send them to their room? Which has a 32"" 1080i TV and Xbox? Yeah right. Granted, she went overboard by piling on the punishments. However, people need to stop being so god damned sensitive when it comes to kids. It's pussy parenting that makes them pricks to begin with (CoD MW2 players are VERY familiar with this breed) Am I the only one that thinks this? My parents never abusively hit me when I was a kid. But if I was being a little prick (which I was... a lot.), out came the wooden spoon. Tl;DR- Stop being whiny pansies and overprotecting kids."
non-insult,"Sitting behind a computer screen some people can be who they truly are: assholes. It's not just Reddit. It's the problem with being anonymous on the Internet. You just have to accept it for what it is. I've put a lot of videos on YouTube. I'm a female. I get loads of comments like ""Nice tits""... ""I would tear up that pussy"".. and I'm wearing a shirt, playing guitar and singing. Some people are just assholes mang. Gotta learn to say effuguys... just do what you do... know what I mean?"
non-insult,"I don't know. My local newspaper if full of assholes. Sports websites are notorious for assholes and trolls. Fark is funny, and full of assholes. I suppose it matters what the content of the website is. Again, the more specific the content the nicer the people seem to be. I can't believe how informative some of the posters on creativecow.net or gearslutz.com are (I use them for work)."
neither,"Alright I'm sorry that in my fit of internet rage I cussed you out, I'm sure you're a stand up guy out in meatspace. However I think you're missing the point of my argument. The point I'm trying to convey is that the majority of women (especially the demographic of women likely to be posting on reddit) don't like being objectified over and over and over again, because after a while it makes them feel like objects. Which is exactly what happens when you get sleazy come-ons over and over. This comic nails it, and in this scenario you are the husband on the bed in the last frame. If we truly care about the women we profess to love, we need to try to understand them better and respond to them better for *their benefit*, not ours. I don't know your life story or your philosophy on men and women, but frankly the attitude you presented in your original posting isn't good enough, and it angered me that the majority of readers were (at the time) identifying with it. Also, >What really irks me while we are on this subject, is when women go out boasting a ton of cleavage and a short skirt and bitch about being gawked at. Dress like a slut and you will be treated as a slut. I realise how this sounds, and believe me -- I'm not that type of guy, but it's true, and I see it happen all the time. This is textbook ""I'm not a racist, but..."" / ""I'm not a homophobe, but..."" / ""She deserved it for the way she was dressed"" rhetoric. Have a think about what you really believe about this scenario, and what the implications are."
non-insult,">there is a girl I have been seeing for the past few weeks Oh boy. >tl;dr girl I'm seeing thinks she might act like a bitch to me because I did heroin in a dream she had. Okay. She hasn't acted like a bitch, but she told you she might. What should you do? Nothing until she acts like a bitch to you. Until then, what's the problem?"
non-insult,"I am an asshole and post like one. I also enjoy other assholes. There is an art to being an asshole, just like you have made being a whiny bitch an art. Living in this world (at least my world) you are going to encounter many people who you just don't like and can't imagine why they act the way they do. Whatever, it is not your responsibility nor should it really affect you. I mean comments only hurt coming from people you let hurt you or thats the way it should be if you are grown. Did you think putting a comment up where nearly every person on the planet could see it and respond was going to be hailed as the next great idea? Wow! When i put it that way I don't know what to think. Another Assholes 2cents"
insult,"WAHAHAH WAHAHAH WHAHAHAHHAHA its not fair mount_pleasant deletes his username BWAAAHAHAHHAHHAHAH!!!!!! Bet this is why ur friend zoner slut bitch girly cunt turned u doen - she wanted a real man, not a cry baby!!!!!!!"
neither,"""is a great way to ruin my afternoon."" I think having your day ruined by someone on the internet who you will never know or meet in real life is a bit much. If you care so much about what people whom you don't know think then maybe not commenting is better suited for you. I don't post much here but have been on digg for years. I've gotten into some pretty heated discussions over the years but never have I let it ruin 5 minutes of my day much less my day. BTW I am female, and when i am in a heated discussion i can hold my own. If someone chooses to call me a cunt or bitch etc, it's water off a ducks back. It just means that i am winning, when your opponent resorts to name calling it only means he has nothing left to say. One of the reasons i like sites like this is because i can discuss various subjects and hear different points of views and opinions. Don't let someone else's opinion effect you. Remember they are like assholes, everyone has one. The problem is not the community, but how you let it effect you."
neither,"> 1. Wait for someone to make a comment about Islam. > 2. Blame all the ills of every nation on the US. > 3. Call any who points out real problems an idiot or moron. > 4. Wash, rinse, repeat. You must be have got me confused me someone else. I have already cogently demonstrated that the US is primarily responsible for the appalling social conditions in middle east and central asia. Your entire response to this has been to dig your thick head into sand because it conflicts with your moronic Eurocentric agenda and make up retarded strawmen like this. Its quite disappointing. >I don't support either war jackhole. My original statement pointed out that people who think they are free are only as free as their laws allow them to be. That's true in every society on Earth including the West. Further laws aren't the only form of social control. Bullying and harassment are very common tools to get people to conform to the West and they leave deadly legacies. To ignore this is pure idiocy. >Religious laws regarding free choice in Muslim society are far more restrictive than those of the West. . You can blame the West or you can look at why this religion (and other religions) spend all their efforts controlling people. Except most of those repressive Religious Laws are enforced by regimes propped up by the West (eg Saudi Arabia) or those that were desperate social reactions to decades of brutal Western hegemony (eg. Iran). Simply ignoring this isn't doing you any favors. Repressive laws aren't inherent to Islam, they are only a manifestations of the extreme and radical elements which the West has been nurturing and supporting for the past few decades. Afghanistan prior to the disastrous American interference in its affairs in the late 70s and 80s demonstrates how Islam can be interpreted to create open, modern and progressive societies and how destructive Western hegemony can be socially. But such a nuanced view of history and Islam clashes with the convenient, self-serving ""ISLAM CAUZES ALL EVILZ"" narrative propagated by Western establishments which you have mindlessly swallowed. By attributing these regressive social conditions entirely on Islam and not the Western hegemony which predominantly gave rise to it you people get to avoid taking responsibility for your collective role in fomenting the whole mess and can keep in place your neo-imperialistic, hegemonic foreign policies. Here's my advice. Take responsibility for your collective fuck ups, stop foisting the blame on others and get the hell out of the affairs of other countries. 9/11 should have been enough of a lesson but America in modern times seems to be populated by fat, ignorant, irresponsible morons like you incapable of even an iota of independent and critical thinking. Thank God America is already on its way down. It pretty much resembles a failed state already. >That is my point and you are free to disagree. Your point is dumb and historically/sociopolitically ignorant."
non-insult,"I have to admit that I‰Ûªve used the word ""sand nigger"" before. But I would never call anybody from the Middle East that. The term I used it in was, ""Get off the sand, nigger. Volleyball‰Ûªs a white man‰Ûªs sport."
neither,"No, you're not the only one. Fairly often I get the thought to leave or just stop contributing. I've unsubscribed from certain subreddits because I just couldn't be bothered with the arguing. ""Oh, an orangered! *click* ...oh :( "" I began to dread getting replies. It's not that I'm unable to confront people, I just don't see the point. I don't particularly like having to do it, either. I'm here to be entertained and to interact in a positive way. I can do without misogyny, racism, sexism and a whole lot of other isms. All I want is some good conversation. Sometimes I get it. Frequently I don't. It's not a case of me not being subscribed to the subreddits that interest me either, since I already am. It just so happens that some of the ones I like such as pics and askreddit are rife with all this hate and one liners with no other purpose but to accumulate internet points. I like getting the daft upvotes too since it's a positive indicator that somebody else out there liked what I said or what I submitted, but when writing a reply I tend to remember the comment I'm responding to was written by another human being. This usually means I don't get a ton of upvotes, but that really doesn't matter to me. I'll probably get a few hateful comments from this, but meh. This time I just won't bother responding to them. You know what they say - never argue with a fool, they'll drag you down to their level and then beat you with experience. Keep in mind this goes both ways - if you happen to think I'm the fool, why bother even trying to argue with me?"
insult,"The reason women like me don't date guys like you is because you're the kind of judgemental prick that would leave a comment like this. My boyfriend would never write snarky elitist insults and baseless, untrue assumptions about people he's never met in someone else's AMA. That makes him the nice guy, and you the jerk."
non-insult,"> but I don't think there is anything wrong with disagreeing about which approach to take I think PZ's attitude here is a reaction to people who don't just disagree. That is, rather than say ""I prefer not to take that approach"" they add on ""and people who do take that approach are being assholes"". There's disagreeing about the approach to take, and there's calling this billboard a case of atheists being assholes, which is something offensive to atheists who happen to agree with the approach."
non-insult,"It's misogynistic. Being a joke doesn't remove that, any more than using ""faggot"" or ""nigger"" as [general] insults aren't homophobic and racist, respectively."
non-insult,">That's because you're interrupting our circle jerk. You hit it right there. It's a huge fucking circle jerk of ""look how smart and clever we are. we don't buy into what people tell us, or empty symbols, or idolize mere men, we think for ourselves...isn't that right Richard Dawkins and Flying Spaghetti Monster?"" Same bullshit, just with less god."
non-insult,":( it's true, especially about mysogeny. sometimes, it'll just set me off to be called ""dude"", ""man"", ""chief"", ""buddy"", etc. only Buddy I like is Buddy the elf! then again, since most users *are* male, they're not exactly wrong for making that assumption. you're gonna find a good cross-section here (why I stay). IRL, there are dicks, pussies, and assholes, right? for every degrading comment you get, there are ten more people reading it and rolling their eyes. some flls just wanna get a rise out of you (think little brothers...). don't let a few jerks ruin your day. I've been at the end of that stick and it's just not worth getting upset about. so a random stranger tore you down. did a random stranger hold the door for you today? try to balance it out maybe?"
insult,"yah,,, u hit a nerve... on my SUPERHARD CAWK U FAGGOT! wanna lick it, u fuckinn jewbait!111 use ur tearz as lube on my superhard cawk newfag!111 hahah suck it all dai an nite yoo nonexistant BITCH!! no cares for u or abowt u... just cry until u lrn2suckcawkreelgud!!111 ahahahahhahahfsuoit4ibyiybkybikbwy"
neither,"I'm a man, I agree. I post long thoughtful responses to questions, trying to help the OP, and I get one upvote, and then 3 downvotes and someone who doesn't agree with me calling me a fag. Then I post some flippant witty comment on something else and get 500 upvotes. WTF reddit. It seems as though this site is about 10% people putting in good comments and the other 90% just sitting around to make a 1. smartass remark 2. meme remark 3. dickhead remark pointing out some little flaw or typo so they can feel clever and bolster their weak little egos. Now when I get some ingrate arguing with me who clearly has no idea that his position is ill thought out and appears incapable of making the mental leap of figuring that out, I just delete all related comments and drop it. Not worth the time. As for what we can do about it; really, nothing. This is a sea of trolls. The only bigger repository of trolls on the internet is the ocean of trolls, 4chan. I'd say if you want meaningful interaction with people, do it off the internet. Sucks, cause there are a lot of kickass people on the internet, but there's an exponentially greater number of small-dicked fuckers whose moms didn't hug them enough."
insult,Snipers were made to be like shotguns dumbass. Clearly you did not get the message about long range prone snipers being hardscoping fags. /pretend qs rant.
neither,"i've run into a few assholes on here. usually they try to make a condescending and witty remark to you to show that they are smarter or more clever. the trick here is not to fall into the trap of responding to them. i'm perfectly able to sit infront of my keyboard, take my time, and tailor the perfect comeback (i'm not as quick in real life lol). but that will just snowball the entire douche bag community effect. because now i'm contributing to it. i've admittedly been guilty of this. i found the best way to deal with smartass a-holes on here is to simply say something disarming and nice. something like ""hey man, you have a good point there :)"" and let it go. this way your not propagating negativity and maybe giving the a-hole you responded to something to think about. and it's important that this ""tacticic"" isn't coming from a place of throwing the other guy off by tossing him a curve-ball of sorts. it's about just generally trying to be a nice person and being genuine about it. then again if you dont want to be nice then you have every right not to be. just realize that you're making this place that much less appealing to people. -my 2 cents."
neither,"edit:^ i commented on the ""source"" being mastodons music. its the source of the words in the comic. you are right, i wasn't talking about this song in particular but saying they ""got shittier with every release"" would imply I was talking about not liking this record as much as the ones before it. if you want to bitch why don't you bitch about the fact this is posted in ""metal"" instead of pics or comics. i was talking about music in a music forum. in fact, i was talking about the band who had their lyrics drawn into a comic. i wasn't aware talking about mastodon's music in a /r/ about music on a thread about the band was ""off topic"". more like one downvoted, the rest jumped in and tried to justify it. i got downvoted because i misspelled a fucking word posting from my phone. oh shit, I'm a fucking loser and you couldn't; understand what i was saying!. i really fail to see how discussing the band is off topic of the thread, read the fucking sidebar for the /r/ in relation to the comic, it was a bad choice of a situation to illustrate, two guys fighting over a girl doesn't relate at all to the lyrics of the song. her boyfirend is his ""holy grail""? ok then."
insult,"> lol. You moron, it's a bomb, it's a weapon - and you've even got its laughable military euphemism wrong: it's the Military Effect Test. Ah, the Dunning-Kruger expert will not cease! Effects tests describe what they were studying, not the stuff which was doing the bangs, you pitiful moron! One of the shots was a physics test package with U233. > I even gave you the link to know all this. You need to try and learn - you can't expect to be spoon fed all the time. Apparently you didnt even read it, or - more likely - just lack the brain power to actually understand what is written. Happens all the time with you."
neither,"Wikileaks - The Tel Aviv Connection by Jeff Gates What is Tel Aviv to do now that it's known Israelis and pro-Israelis 'fixed' the intelligence that induced the U.S. to war in Iraq? Fool me once, shame on you. Fool me twice, shame on me. Con me consistently for six decades and the relationship is over, as is Israel's credibility as a legitimate nation state. Tel Aviv knows this. But what can the Zionist state do about it? Answer: Wikileaks. Why now? Misdirection. Shine the spotlight on Washington to take it off Tel Aviv. That's good old-fashioned psy-ops. And challenge the credibility of the U.S. That's Wikileaks. Any credible forensics would start by asking: to whose benefit? Then look to means, motive and opportunity plus the presence of stable nation-state intelligence inside the U.S. Other than Israel, who else is a credible candidate? Notice how quickly Israel's role in the peace process vanished from the news. Now it's Iran, Iran and more Iran. To whose benefit? Tel Aviv knows that the phony intelligence on Iraq leads to those skilled at waging war ""by way of deception"" - the motto of the Israeli Mossad. Wikileaks are noteworthy for what's missing: the absence of any material damaging to Israeli goals. But still Tel Aviv faces an unprecedented peril: transparency. Americans know they were duped. And Israel rightly fears that Americans will soon realize by whom. Tepid Support will not Suffice Obama has behaved as anticipated by those who produced his presidency. Anyone surprised at the lack of change in U.S. policy in the Middle East fails to grasp the power of the Israel lobby. Did he hesitate to support their latest Israeli strategy for scuttling peace negotiations? Absent peace, the U.S. will continue to be the target of those outraged at America's unflinching support for Israel's thuggish behavior in pursuit of its expansionist goals. Confirming the lobby's influence, Netanyahu announced he would not agree to halt settlements on Palestinian land until Obama reduced to writing a $3 billion bribe. In return for a proposed 90-day freeze, what form of bribe will America provide? Twenty F-35 jets at $150 million each plus parts, maintenance, training and armaments. That's $231 million per week or $1,373,626 per hour. What will the U.S. receive in return? A temporary partial freeze on settlements. How many more times can this ruse work? Israel has evaded a peace agreement since it drove Palestinians from their land in 1948 and seized more land in 1967 to shape today's geopolitics. Should Israel reach an agreement with the Palestinians, Secretary of State Hillary Clinton proposes a ""comprehensive security agreement."" At what cost no one knows. The U.S. Congress has already budgeted $30 billion for Israel over 10 years. This latest $3 billion is on top of that. That doesn't include the cost to American credibility posed by an offer to veto U.N. recognition of Palestine as a state. And a pledge Never Again to pressure Israel on settlements. Plus the freeze omits East Jerusalem where Tel Aviv insists on moving ahead with new housing starts. Timing Is Everything By scheduling its latest incursion into Gaza between Christmas 2008 and the January 2009 Obama inaugural, Tel Aviv ensured only muted opposition during political down time in the U.S. Thus it came as no surprise to see an agent provocateur operation on Thanksgiving Day 2010 as Israel demolished a West Bank Mosque and a Palestinian village. After seven hours of nonstop talks, Hillary Clinton praised Netanyahu as a ""peacemaker."" In return, he agreed only to ""continue the process."" Meanwhile, U.S. elections marked a major victory for Israel when incoming Republican Majority Leader Eric Cantor, a Jewish Zionist, announced that the new majority would ""serve as a check on the Obama administration."" The Israel lobby has good reason to gloat. Confirming ongoing duplicity, Israeli Foreign Minister Avigdor Lieberman proclaimed: ""a permanent agreement is impossible."" Wikileaks' release of confidential diplomatic cables provides Israel an opportunity to undermine U.S. relations worldwide while also inflicting lasting damage on U.S. interests in the Middle East. After this, what nation would trust the U.S. to maintain a confidence? In October, Turkey asked that the U.S. not share intelligence with Israel. Now who dares share intelligence with the U.S.? This may signal the beginning of the end for the Obama presidency his domestic policy failures are eclipsed by his failures in foreign policy. This may also signal pre-staging for the 2012 presidential primary with a weakened Obama forced to name Clinton as his running mate or stepping aside so she can lead the ballot. Her 2008 presidential campaign promised recognition of Israel as a ""Jewish state"" and promised an ""undivided Jerusalem as the capital."" Tel Aviv was elated. A second Clinton presidency would ensure another victory for Israel - and no peace. Israeli psy-ops typically serve multiple purposes. Wikileaks is no exception. Jeff Gates is author of Guilt By Association - How Deception and Self-Deceit Took America to War. See www.criminalstate.com"
non-insult,"Reddit needs one of two things. Either all the decent people need to band together to shout down the assholes, or we need real moderators - people who have and deserve the authority to delete comments, ban users, etc... to keep Reddit clean of the riff-raff. I'm not sure I see another option. Although you can get a partial solution by requiring adult verification for all users as no small number of assholes are teens."
non-insult,"> If you down vote me you are a complete fool. Guess I'm a fool then, no arguing with- wait, I see what you did there! The human mind can't comprehend the complexity of the structure and the countless real-time operations of both the hardware and software that went into making this post either, does it mean that Reddit doesn't exist?"
insult,"Actually, it's all culture. Go derp in a commune, faggot."
neither,That's a BIG BITCH! movie?
neither,"Xoites is simply being a typical feminist... Argue, shame, attempt to shut down debate, 'misconstrue' arguments, appeal to the crowd while ridiculing, accuse of impotency or other de-masculinizing condition, and then stomp off in a huff. This is all that Feminists ever do. They do not 'get won over', they do not even get convinced on one or two issues (DEFINITELY not enough to actually do something about it - although they'll ""personally agree"" until they're blue in the face). But they serve as excellent rhetorical scratching posts, as well as an excellent example of what happens when you try to 'reconcile' or 'compromise' with a Feminist. The more of these assholes that come here, and the more time MRAs spend wasting their time on concern trolls that do nothing but eat up MRAs time (and feed them false hope), the better. It'll make men that much angrier, and that much more determined. You know, those people women depend upon for protection? Of course, they will have to deal with the consequences of having enough men so angry at them and the government that men will override their biological impulses to effect change....but if they're too fucking stupid, or self centered to care now, why the fuck should I or anyone else try and save them? So really, xoites is fun to argue with, but don't read any more into her than that. She's simply a typical sexist feminist...dime a dozen, nothing to see here...."
insult,"Man, your friends are jerks. Even if I didn't like someones joke on facebook, I wouldn't spam their wall with all that negative crap."
non-insult,"> Do you have any examples of misogynistic comments That ""bitches love smiley faces"" video that got popular gave a tremendous number of Redditors *carte blanche* to now use ""bitch"" in place of ""woman""."
non-insult,"That's not all I suggested by a long shot. Read the whole thing. I suggested making lists about what makes you happy and what you want so that you can get clear on what that is. I suggested getting yourself out of situations that make you miserable and going for what makes you happy. How you do that depends entirely on your situation. You can either get rid of the shitty things that you're capable of getting rid of and go for the things you can get that make you happy, or you can nitpick posts on reddit. If you have methods that work better for you, use them. The main point is to get off ones ass and change things rather than sit and bitch."
