subject,content
neither,"I have been preaching this for years. I have been in this country since 1985, I was only 4. I have not left the country since then except for 8 months (not continuous) last year. I have noticed this trend since I was 12. However, I only voiced my opinion one time and the feds showed up at my house. So I have kept my mouth shut. It is very much time for the citizens of america to stand in the face of the govt. and ""remind"" them that they work for us, not the other way around. The basic fear that exists in the average spineless american is something that those in power rely on. The fact that you are not willing to sacrifice the small comforts you have to actually make the world a better place is part of the fuel used by corporate america and its govt. cronies to keep the average american in their place, working and in debt until they die. That way, they can effectively stifle personal growth, keep creativity to a minumum, and retard forward progress. All three can destroy the system as it is. The best course of action: organize in your community and boycott large corps. (walmart, att, verizon, merck, amazon, bestbuy). then, if you work at one of these places, arrange a day where no one goes to work. these corporate fat cats would be nothing without the workers. I bet if the people of this country sat at home one day, those corporate assholes would change their tune super fast. and whoever said that thing about multiculturalism brings division, you are wrong. this country was founded on multiculturism...in fact, that is why this country has become so great. so great in fact that people still want to move here even with all the bullshit. so in conclusion, fuck wal-mart, don't use ur cellphone for the internet and only call when you have to, and arrange in ur community to kick the corporations out of your neighborhood (start a community garden, shop from local stores and stay away from the national chain stores). remember what this country was founded on... We hold these truths to be self-evident, that all men are created equal, that they are endowed by their Creator with certain unalienable Rights, that among these are Life, Liberty and the pursuit of Happiness. That to secure these rights, Governments are instituted among Men, deriving their just powers from the consent of the governed, That whenever any Form of Government becomes destructive of these ends, it is the Right of the People to alter or to abolish it, and to institute new Government, laying its foundation on such principles and organizing its powers in such form, as to them shall seem most likely to effect their Safety and Happiness. Prudence, indeed, will dictate that Governments long established should not be changed for light and transient causes; and accordingly all experience hath shewn, that mankind are more disposed to suffer, while evils are sufferable, than to right themselves by abolishing the forms to which they are accustomed. But when a long train of abuses and usurpations, pursuing invariably the same Object evinces a design to reduce them under absolute Despotism, it is their right, it is their duty, to throw off such Government, and to provide new Guards for their future security."
neither,"I would agree, but did we really need ""you weak, selfish prick?"""
non-insult,"i've given up on voting or really participating at all in our ""democracy"". the only vote that REALLY matters is with your dollar. and it's just that simple - don't buy shit from douchebags and america will be a better place"
non-insult,I don't take it personally. Hearing the other side is part of the reason I'm doing this. Don't let it own you or the assholes have won.
insult,"Thank you for provingthe point that no one will say, but everyone believes: that you are a jackass. You didn't have to come in here and ay that but you did. It's not even a valid response. Fuck you, you piece of shit."
non-insult,"For some reason our (American, as thats the only thing I can rightly speak about from experience) culture is cool with women comforting themselves with such things because they are viewed as emotional and weak. Men on the other hand are viewed as ""tough"" and shouldn't have to resort to those things to feel ok. Major religions are exempted because most people don't look at the same way as these sorts of things (though it should of course.) For example: A woman could have a bad day, and go eat a quart of chocolate ice cream to feel better, and no one would blink. But a guy doing the same thing would get jibes for being a ""pussy."" Again, I'm not saying its right, but its true, and I think its related in some way."
insult,Blue Moon will happen in N. America too dumbass.
non-insult,What? I'm sorry I lost track of time and didn't give you a timely reply. I'm sorry you think I'm a moron but I would like to strongly state that I feel my ideas are backed by well-researched facts and your summary dismissal of them is quite hurtful to me.
insult,"As a cyclist I'd say the following to: > The other day, I had my walk sign, and a guy on a bike almost ran me over. He looked at me like I was the one in the wrong. Clothesline the fucker. There's no excuse for that kind of douchebaggery; especially when cyclists are often on the receiving end of it from motorists."
non-insult,She really needs to trim her pussy hair.
insult,"Do you even know what metric means, you moron?"
insult,"Yup, I thought this might happen; I wasn't calling you an ass, I was just adding that those who act like jerks are asses. By dating another girl you fall under the category of ""stronger version of walking away."""
insult,You're a moron.
insult,"fired? This moron should be executed with a bullet to the back of the head. And lastly, get in line if you disagree because you're dead flesh in this universe. KILL ALL theists NOW. repeat."
neither,"This guy sounds like a Markov Text generator from nutcase websites. Hey! That gives me an idea! > The Illuminati conspiracy theory which holds that globalism, with God. The Illuminati develop could in control, not outside of the mind. Their alleged to the Illuminati. According to develop could in the International Monetary Fund, the words of His overall goals. The Illuminati conspiracy is summarized in the lake of the Illuminati conspiracy and manipulate the super powers of Satan, tools to understand about the Illuminati conspiracy. Popularized in the Illuminati conspiracy, the International Monetary Fund, the Illuminati supposedly have overcome the Illuminati. Does the antichrist, the points on the direction of the Illuminati conspiracy. generated off some conspiracy site > EARTH STANDING STILL I defy God have a hell on Harmonic Time Cube Collection of the heinous hoax they are dumb, ignorant, educated ONEness posture will be returned to be light from the whites are dumb, educated stupid and midnight The Cube Collection of Earth into Opposite values cancel out for holocaust deserved The Value of Earth for all life it revolves around the highest office on Harmonic Time notches that your ONEness posture will not rotate around Earth has ruled over Earth No Dark and Light Domain Hell cometh to fight back guess where that came from?"
non-insult,"Liberman is awesome, and commy healt care is for morons, its won't work, let the market in and health care would train 20million more docs and commodify it and same with drugs and bam a ok. Its governmetn shortening supply with regualtions and corps buying off gov for monopoly is the problem. Oranges and apples are plentifual same should be for docs fuck the AMA and its limiting number of grads due to wanting t keep wage high stupid commies communism never works and if it did why no free mansion and ferrari for all?"
insult,">That's just not cool. Yes it was. You simply lack a sense of humor. Personally I thought people's reactions were awesome. It was a foreseeable outcome of his post. If he didn't want his Karma to tank then he wouldn't have posted that hunk of troll bait in the first place. Also, I think you're being quite the douchbag for stepping into a matter of this nature. That is just my opinion though. I tend to be outspoken."
non-insult,"I once accidentally killed a weapons merchant on RE4 right before the level changed and couldn't get him back, moved on to the next bit and it was just impossible (where you first meet those spikey motherfuckers you need a sniper rifle with infra-red scope to kill), had to start from scratch... i know that's totally irrelevant but i feel your pain."
insult,"I would imagine being Limbaugh's doctor would create a scenario something like the recent House episode, The Tyrant. I say kill the bastard!"
insult,"You're welcome, you fucking shithead."
non-insult,This. We have every right to bitch.
non-insult,And not be a teammate. Act as one and maybe people won't be a bitch.
non-insult,that's a lot of dead motherfuckers
insult,You are a troll and a dumbass.
insult,So apparently you wankers want to take back the colonies... I do like myself a damn good fight. Bring it hither!
insult,Damn old people in general. Fuckers need to get with the times or get the fuck out.
non-insult,"someone needs to invent a vibration adjustment for phones. some phones vibrate way too much. like my first blackberry. i think that was in about 2001 or something. i was in court and all careful to turn my ringer off but it was in the outside pocket of my briefcase and it was a really small courtroom. fucker sounded like thirty bumblebees. and whoever it was, wouldn't quit calling me. the judge was making faces and it wasn't my turn to argue my motion yet, and i was trying to figure out what to do because i didn't know how to turn it off completely, and i was kind of trying not to let on that it was mine. eeesh. fortunately there was a coat rack and everyone had piled their briefcases in the back by it so i wasn't sitting right next to mine. but it bumblebeed through the whole morning."
neither,"im bidding ...if i win im gonna leave feedback saying ""A+++KILL THAT BITCH"""
non-insult,"What happened in this man's mind: He flew out the window into a tennis club, moving so quickly that his clothes caught on fire. He quickly grabbed a brown fire extinguisher and put himself out, which left him naked with only mild burns. While running back to his apartment, he found a ferocious wolf about to attack an innocent woman. Mustering all his strength, he choke slammed the monster and saved the woman's life. She was so happy she screamed with joy! After the police arrived and took him back to the station, and he grinned broadly as they took his picture for the medal. Theennn he came down and was like oh fucking motherfucker."
neither,There were some desperate mother fuckers going to the movies in February. Madea Goes to Jail made 41 mil on the opening week. You would have to pay me to watch that shit.
non-insult,Dressing up in Aluminium foil will not fool the Google armies
neither,"You look like 'cutthroat bitch' from House. Also, I only see one picture..."
non-insult,"I'm sorry if I sound like a dick...but...GET YOUR ARSE OUT THERE!!! Post a profile on a dating site, or a social site or something. You said you're better right. I've been there too friend. Perhaps not as badly as you. It's seems scary at first, but...really, you need to do this. Just go to a fucking bar or a cafe and just talk to someone. Or meet someone from online. And then do it again and again. Trust me. You're the only one stopping you. ed: it's been a shitty decade for me too! The next is damn well going to be better."
non-insult,"Basically, I moved here unprepared, Living in a hostel,moved into a temporary situation and got tossed two day later, I found another one after ending up in a shelter for a day, Well besides the guy wanting my nbunghole I had all the time in the world to get into school and find something workable, I botched every interview, so I didn't find something workable and ran out of time as the guy got impaitent with me for not giving said bunghole, I also sold my laptop several times, so I ran out of time and moved into a hostel a went to more interviews, I botched all of those as well. I stayed with a friend until about now and luckily she's awesome but I'm out of time and money as I decided the best option was to be out be seen in order to make connections(You can read that as drinking to much) I on the scraps on my unemployment and I can either wait it out until the end of January or run. which aren't actually options at all."
non-insult,"Find simple pleasures instead of spending money. Hike, bike, take public transportation, walk up stairs, make love, look up at the clouds in the sky, or stars at night. Relax my shoulders and neck. Grow a garden. Smile at strangers, but don't be anybody's fool. Appreciate the gift of life, and sleep soundly at night."
insult,bitch more
non-insult,True. Even those of us who monitor how long you're connected to a particular site/port raise a bit of an eyebrow if we notice your workstation connecting to a local ISP home IP instead of the typical work domains/ip's... Connection statistics are a bitch.
insult,"Hey, go easy on him here. He's got a lot at stake. If he doesn't come up with the money in 48 hours, god's going to turn him into a lying money-grubbing hypocritical scumbag."
non-insult,Apparently reddit is partial to pussy.
neither,"That's my assumption. If you can't say no, then at least leave with some dignity. when I see stuff like this I don't feel bad for either party. The woman was being a bitch, and the guy would rather have the comfort of not being alone than being happy. You get what you give."
non-insult,Dressing up in aluminium foil wont fool Google armies
non-insult,"To be honest, I can't conjure up a lot of sympathy people who play a game but don't know the basic game mechanics. If that makes me a jerk, then it does."
neither,"I work private security at a hospital. When those assholes act up could you simply throw them out instead of beating them up? If they get hurt they come to me and swear that it was me that beat them, and now I have to deal with it. Either that or hire me with you so I can be the one beating them up."
non-insult,you lucky bastard
insult,"i work at a large canadian courier company. Spend the 2 dollars more and invest in a proper fucking box, assholes."
non-insult,Lil Wayne - Pussy Money Weed *kidding* I have to go with troublemaker by Weezer. my friend left me in his house alone. time for mischief!
non-insult,"_facepalm_ Upvoted, you magnificent bastard."
neither,That bitch is homely.
non-insult,"Sherlock Holmes: All we have to do is follow the tracks, Watson. It's fool proof! Watson: *Where the...? I don't even-"
insult,"Hair is the most filthy thing. Supposedly more so then a fly so I say, your roommate is a dirty bitch who needs to learn to clean up after herself :)"
non-insult,"[while dunking the Dude's head in the toilet] Thug: Where's the money, Lebowski? Where's the fucking money, shithead? The Dude: It's uh... uh... it's down there somewhere, let me take another look."
non-insult,Inflation is a bitch huh. Get ready for more price increases as the value of our funny money falls through the floor!
non-insult,"The AK-47.... for when you absolutely, positively **have** to kill every motherfucker in the room"
non-insult,I'd bang that chinese bitch on the left.
non-insult,My blackjack is a similar device and has the same problem. If I have some change in my pocket and that bastard vibrates I might make the entire building's walls resonate..
insult,"You do not understand the first thing about what was being said. The article was about what your staff should do, not what you should do as a diner in a restaurant. DID YOU EVEN READ IT... fucking retard. As a diner I bet I treat my server better than you, dimwit. Go back to mourning your sister, (who's probably fine, if you even have one) and BE SMARTER."
non-insult,"Honestly I wouldn't want an apology, bullys taught me valuable shit about dealing with assholes. Who else would teach me to stand my ground and throw a fucking punch when necessary."
neither,"Agreed. I said ""Twenty ten"" before, but now I want to say it the longest ways possible just to piss this prick off."
non-insult,"funny, i think it should be the opposite. in a modern educated democratic society it should be an embarrassment to associate oneself to a group of people that have historically been oppressors and murderers and thieves. the royal families of today have nothing without all the sins of their ancestors. how did they get all their land and property? their money? maybe there's something important about being awarded a knighthood that i'm not aware of? does it go only to entertainers that sell us movies and music the way that governments sell us war? or is there another purpose other than circle jerks for the rich and famous?"
neither,Lol they are afraid of getting beat up by a bunch of fags.
non-insult,"It's a type of knowing. There is no explanation you just know. Sometimes like a sixth sense. Men probably have it too but women are probably hyper-intuitive to keep children from harm. Women have been taught to ignore this ""sixth sense"" because there is no explanation for why it occurs. **Edit:** Someone just posted here in 2XC a link to The Business of Being Born and the trailer states that women in the U.S. are basically told that they don't know how to give birth - properly. We're not allowed to rely on nature because men and machines know what's best for our bodies. When I was pregnant I didn't go to a doctor until I was around 6 months. The nurse that treated me was an utter fucking bitch to me. So I'm a bad mother because I don't follow man rules. Maybe religion is based on women rules. Men have sports and war. How come women can't have God? God does not start wars. MEN do."
neither,"They thought fags would take over in the 2000's.. too bad they didn't make rainbow colored pen drives back then.... they would have been better as a storage device, and probably work better for bartering with the rainbow brigade"
insult,"No, we're not voting on the game of the decade, we're voting for our favorite game. Also, fuck reddiquette fuckers."
insult,"""Hawaii to many Americans seems like a foreign place."" Mele Kalikimaka you stupid son of a bitch!"
insult,"I do. I hate the unnecessary noise pollution created by mobile phones. Put that shit on vibrate you inconsiderate assholes. No one gives a shit about your clever ring tones. If you are in a restaurant, museum, or any other place please excuse yourself and take your phone call outside. If your call isn't important enough to go outside the immediate area where you won't disturb anyone, then you shouldn't be answering it in the first place."
insult,Dumbass.
insult,"Whoa! This changes everything! No - wait. No it doesn't. It means nothing, you snarky, trying-to-make-a-stupid-point, no life FOOL. There. I'm done."
neither,"If you're going to claim to be better than him, then you have to actually BE better than him. Nothing pussy about not being a hypocrite."
neither,"Generally speaking, how was/is your relationship with actual soldiers in Iraq? I was a young (20-21) year old Sergeant in Iraq in ~2005, and I was in charge of logistic combat patrols in the Tikrit AO. For the most part the various PMC's and operators were very cool, and respected my position. But there were a few times where I basically had to yell: ""listen motherfucker, this is my patrol, and these are my vehicles, if you want to get to Speicher, you're going to shut the fuck up and listen to the combat briefing"". Oh, also, what kind of qualifications do they look for for non combat positions (if those exist). I had a combat MOS, and was a Non-Com, but I've been out for ~5 years. There are days when I just want to say ""fuck being a computer nerd"" and go back to Iraq, where life is easy."
non-insult,"Fair enough, but maybe you should show how its NOT the case in this instance. Are you assuming or do you have some solid evidence that no one else can produce? Its fine to have an opinion, but to fully back a side without supporting evidence is still just your opinion. Opinions are like assholes......."
insult,">FBI/Customs let passengers from another flight co-mingle with the passengers of flight 253 while the most important investigation in 8 years was pending. If that was the most important investigation in the last 8 years this country is in great fucking shape. This guy is probably exaggerating every little slightly incorrect detail that was mis-published for a reason. Have some patriotism and trust that the government can deal with national security better than you can, you self centered attention whoring prick."
insult,"Ha, morons are out in full tonight."
neither,"What really bothers me is people who have long music ringtones set for their text message tone. My roommate and sister both do this. Even worse, my roommate is a jackass and sits their and lets it ring before he turns off the alert, even when it is in FUCKING ARMS REACH. I want to grab the phone and smack him with it every time this happens. Nobody wants to hear the same damn song 50 times in a day, so please, shut it the fuck off."
non-insult,"So the flat earth society threatens to bomb any store that sells globes. Where does cowardice end? Constitutionally you are correct, it's not a violation of the first amendment. I'll conceed that willingly. But culturally we are collectively handing over western civilization to shitheads. Piece by piece, book by book."
non-insult,I think 12 is too young to use the term 'douchebag'. At 12 you can be a 'dumb punk' or a 'little prick'. Douchebaggery starts at 16.
insult,The guy calls the reddit community 12 yo douchebags for downvoting his comments and then his comments get downvoted. Seriously what did he expect would happen? He is clearly the one acting like an asshole.
insult,"you conservative blood sucking bitch, come fight me."
insult,"Well, then you're one hell of a confused moron. http://bit.ly/HKgh"
neither,"This is a complex question that deserves a nuanced, erudite answer that I am too drunk to give now. At this moment, I would say that comparing Americans to the French is going to be a source of endless disappointment. Hell, you would even be disappointed if you compared the French to the Germans in the same respects. Anyway, the thing you are missing is that the problems facing America now have been, in a way, centuries in the making. Read Ben Franklin's Autobiography and you will see all of the horse shit wisdom this country was founded upon. For example, the appearance of industriousness is more important than being industrious according to Franklin. And fucking then, let's not forget the Puritans. There are puritanical ideas floating around in America this very day that were never allowed to come to fruition in Europe **because they kicked those assholes out**. Sorry for the drunken rant. But if you take nothing else away from this, take away my recommendation of Max Weber's *The Protestant Ethic and the Spirit of Capitalism*."
neither,"Whore, cunt, slut in no particular order."
non-insult,"All the survivors start a new community of natives. Another plane crashes on the island, and history (or future...) repeats itself."
non-insult,"They shot unarmed people - I call that at least manslaughter. That it should come to trial is in the public interest. Nobody should be above the law and the fact is that people were getting contracts with weapons who shouldn't have been. They are an undisciplined, unprofessional rabble, subject to no laws. Oh, I don't go from this incident but from what the soldeirs have been saying. It is probably a good think that you aren't going to chance your ass in a foreign country where the locals have been upset by such actions. This is an exceptionally good way to create enemies for the future."
non-insult,I can confirm this. I have a Crackberry.
non-insult,"I am REALLY surprised you can drive that car, I've been looking for something to drive because I'm tired of my big suv. I'll have to check out the neons, I'm guessing most of your weight isn't in your waist? Also, that you can find comfortable restaurants. Booths are the bane of my existence."
non-insult,"Oh my god, why am I checking reddit now?"
non-insult,Boooooo.
insult,"pretty sluts vs ugly sluts, woo hoo"
non-insult,You mean Darth Vader is basically Cheney with a mask.
non-insult,"The story was not what I was expecting. I am sorely, sorely disappointed. Nice name though."
non-insult,With the hat to match
non-insult,No
non-insult,Having a good party?
non-insult,I'm spending the evening with Anna Karenina.
non-insult,Even less for the women who kill their newborns and dump them in garbage cans. Double standard yadda yadda yadda...
non-insult,"Haha, thats hilarious. You have awesome Grandmas"
non-insult,I would guess the majority of people eating Ramen are college students on a budget. Highly capable of boiling water.
non-insult,If you don't count Tupac.
non-insult,"When I lived in Germany, I had a friend who told me that his grandfather had died in a concentration camp. He fell from a sentry tower."
non-insult,Not as much time as I've spent in jersey.
non-insult,"but i dont think we celebrate this type of mentioned culture Anymore. Look at the Indie mindset, its partially just being original for the sake of itself, regardless of its quality. (not to bash indie too hard...) The old Jazz has become Rap music, Rock n Roll has become metal, The newest book has become Twilight."
non-insult,wget or curl
non-insult,"a, b = b, a Swaps 2 variables without the need for a temporary holder."
non-insult,I'm moving to Sweden.
