subject,content
non-insult,"I like Scott Lynch - the Gentlemen Bastard series - ""Lies of Locke Lamora"" and ""Red Seas Under Red Skies"" so far. ""Name of the Wind"" isn't a series, yet, but it's one of the best fantasy books I've read in a long, long time. I think R. Scott Bakker's Prince of Nothing series (""The Darkness That Comes Before"" et al.) is brilliant. It's big and it's dense but its as close to ""literature"" in fantasy as I've come across. I'd also add a vote for Sanderson's Mistborn and Abercrombie's First Law Trilogy. His followup stand alone was good too."
neither,All and all. Just another prick in the wall. Fixed
non-insult,"The first ""Bitch Please"" one is PERFECT."
neither,"Sometimes it can seem like Reddit has a hivemind, but I completely understand and agree with you. My fiance got me hooked on Reddit and for the most part, people are friendly enough. My bad experiences are not because of something I've done but misunderstandings or people who just don't agree with you and BOOM, downvote. Examples are a comment I posted in a Twilight thread laughing at a magazine article interviewing Robert P. about his role as Edward and how he hated the role. Naturally, every single negative thing posted in that entire thread including mine was downvoted to oblivion by raging Tweenies. Another thread I posted a link trying to disprove the stereotypes that people have about pitbulls, but commented I would PERSONALLY never own one nor trust them around my own children. Downvoted for..who knows why, someone even called me a moron. I would suggest just not letting it get to you, since Reddit as individuals are generally smart, open-minded and kind-hearted and there's always going to be people who just either can't see the other side or are in a pissy mood and down-vote you for whatever reason. =)"
insult,"Even if I print a blank word document, the page will have a header with my name and a footer with the date and time. Wasting time/energy/paper. Learn how to troll bitch."
non-insult,">They might be ugly, dumb, smell like shit, and shoot like Michael J. Fox all hopped up on crystal meth, but they're some determined motherfuckers. Was this in reference to the Taliban, our soldiers, or both?"
neither,"I thought it ended up being overturned in court and Lincoln refused to comply. Regardless, Lincoln was a scumbag who did all kinds of illegal things to anti-war protesters."
neither,"If I were you I wouldn't suggest to the people of Texas they should be ashamed of anything. Why should an entire state be shameful of the comments of one, misinformed man? Be Proud to be a Texan. Be upset that this moron represents anyone."
non-insult,are you kidding? in s korea being a sc pro is like our celebrities and sports players combined. they get ALL the pussy.
non-insult,Jackass kids driving round and round burning gas and holding up traffic.
non-insult,I'm 29 and I still have all 3. I ingeniously gave my 4th tooth to my brother. Poor bastard and his 5 wisdom teeth.
neither,"In everyday life I'm a pretty chill person, but when I read the absurd headlines and comments that have tons of upvotes I can't resist the urge to argue a counterpoint. In fact, that's about 90% of the reason I keep coming here because I disagree with just about every hivemind opinion here and I enjoy debating the arguments in my head. Sometimes it becomes necessary to speak up when a circlejerk is in progress, if only for the silent minority out there who also disagree but feel threatened by the ignorant pricks who have no original thoughts of their own. For example, how many people actually think about what Jon Stewart says before parroting his opinions as their own? How many times do we have to repeat the same tired memes or read a hundred lame jokes before getting to the handful of insightful comments? Also, picking out one particular instance where the vocal majority are wrong is an exercise in futility. If you're not militantly atheist, politically left-wing or libertarian, or don't abuse drugs then you're in the same boat as the women here. Hell, if you hold a nuanced opinion about ANYTHING you are going to catch flak for it. It's not unique to reddit- it's human nature through cognitive bias. The intolerance cuts many ways and yes, the ""community"" would do well to grow the fuck up, but that's humanity for you. Try not to let it ruin the cool parts that you enjoy. My advice would be to grow a thicker skin and seek out subreddits that aren't dominated as much by groupthink or people gaming the system for karma."
neither,"You must live in Florida, like me. I've noticed that the north east is much better at this. I guess all the assholes move south."
non-insult,In the mall you flash titties and rub your pussy and this has never posed a problem. I highly doubt it.
neither,">Those assholes took more than $3000 out of my accounts in less than a year, I'd like to see them collapse asap. That sounds like blame to me."
insult,The idiot just doesn't understand that he can't send the drooling morons who follow him out to game Google without repercussions. For months now he has had his listeners do multiple searches on the same subject just to get his stories pushed to the top of the What's Hot list. Why? So he can generate more hits on his web site and collect that advertising cash. He's nothing more than a scummy spammer and Google was absolutely correct to ban him and his idiocy from **their** web site. He'll just have to find new ways to spread his lies.
non-insult,"Same exact reason I don't post much. For instance, I posted a video that I (mistakenly) thought redditors would get behind and instead they told me to quit being a bitch. So I stopped submitting. And all this after everyone told me how much better reddit was than digg..."
insult,"Dumbass, you're supposed to warm up the hair gel first."
non-insult,"That's not a correction. Don't be a jackass - just say ""and **here's** the video it's from."""
neither,"I don't understand /r/minecraft. You guys call the people constantly complaining at Notch self-important assholes but you rip me apart for submitting a video *by request* and not timestamping it or trimming off the first part of it. (not you, personally, as you seem like you are prepared to talk to me in a polite manner, just talking about some of the other comments)"
neither,"While physical laws are (at this point in our history) easier to distill into (mostly) accurate formulas, the overarching trends found throughout history in varying societal structures should give us reassurance about what we should expect from the government of the USA in the future. It's obvious that the few rich people (colloquially known as *assholes*) are propped up by the toil of the many. The process by which this happens is often occluded in the analysis, which is ironic considering the ubiquity of the methods by which the economic elite take advantage of the poorer. The confusion should be expected in this case, because the medium through which people are disadvantaged is so (intentionally) convoluted that the truth of the matter, when spelled out, seems utterly contrived. Back to your point: The USA is no different from Soviet Russia or Nazi Germany. That's absolutely true, and not just in some broad, abstract sense of 'what could be.' The problems those countries faced in the time leading up to their legendary missteps mirror ours specifically, and as such, so will the mechanisms by which extremists (fundamentalists and radicals alike) take advantage of the weaknesses thus brought forth."
non-insult,"It's a risk I'm willing to take, to be honest. Downvotes aren't the end of the world. I've actually been surprised at how many upvotes I've received when responding with how I really feel to some misogynist bullshit. Sure, I'll get some nasty comments, but those are usually downvoted. Seems there are a lot of people on Reddit who feel similarly to me, they're just too afraid of being seen as a humorless feminist bitch or whatever."
neither,"There's a difference between idiocy and ignorance. He was acknowledging that not being ""a fucking pussy."""
insult,insecure assholes.
non-insult,"I was at one of their protests once (not attending, I was simply getting pictures for my high school's newspaper). A friend of mine had made a sign that read ""GOD HATES ASSHOLES."" On the other side it read ""Don't hate, bro."" Almost everyone who drove by and saw it gave him some form of positive feedback--it made me happy."
insult,"Oh cry us a river, there's no one for you to call and have play big brother for you. Poor baby, you have to do it yourself. Get out of your pajamas, phone up your friends, go over there, and help him move out. What do you think this is, another stupid thread on the Internet about some random slut's mean boyfriend? **It's not.** It's a thread about **tissue damage**. On your sister's only and irreplaceable body. She'll kill herself, and she'll be right, because she is utterly alone in the world and no one anywhere gives a damn about her."
non-insult,"You mean, cock in hand. It's more like a circle-jerk..."
non-insult,"For the record, as a female who has been around for a couple of months, I don't actually find Reddit that sexist and misogynistic. I think a lot of the sexist comments are more about mocking people who would make those kind of sexist comments *for real*, than they are about mocking women. Sure, there are always a few jerks, and yeah, I probably wouldn't hang out in r/mensrights, but it rarely bothers me... I'm not saying that women who do feel that way aren't entitled to their feelings on the matter, maybe I just haven't stumbled into the really dastardly dens of misogyny yet, but I will say that I've never felt seriously attacked for being a woman, and I've seen very few others be seriously attacked either. Some fucking with and joking around? Sure. A bit of trolling? Definitely. But that's kind of par for the course just about anywhere online..."
non-insult,"Based on the average printer (and not including that information in your original post)we would assume that you have a normally printer setup that does not auto-print a letter head.[](/melvin""and using an expletive like ""bitch"" makes me feel u mad bro. probleM?"")"
insult,"It had more to do with my half-sister's paranoid delusions (that dad was a millionaire, that my mother who can't even program her digital clock had somehow maneuvered it out of the country [after 9/11 when anything more than a few thousand gets you flagged for investigation by the feds], that my mother was stealing from my mentally handicapped other half sister) than it did with any *actual* possessions or funds. And this crazy bitch is a *school teacher*."
non-insult,You'll look back in a year and see how absurd you're being. Not trying to come off as an arse as I also went through the same thing. Just go reconnect with your friends for now.
insult,>if you are a Texan I would be ashamed to call yourself that after this exchange. Are you trying to insult racists with a racist idea? Fucking moron.
insult,Condoms are for pussies and faggots. I go rawdog.
non-insult,"I added this to my Netflix instant queue and threw it on one night for some filler, purely to provide background noise during some video games... I was thinking *surely there's nothing new this film can teach me about cannabis, it's just going to be a giant circle-jerk like all the others*. Long story short, the PC got turned off and I ended up watching one of the best documentaries I've ever seen. My two unenlightened roommates ended up watching it as well, and I think they learned a thing or two. Thanks for the film! It's really become a cornerstone for educated, responsible marijuana users around the world."
non-insult,"UW *Is* an incredible school, but it's rapidly becoming more and more of a goddamned gathering sight for Southern California transplants who couldn't get into USC, or UCLA. Then, after school, *(graduate or drop out)* they settle here and do nothing but bitch and complain about how they miss SoCal, and **fuck up** our already **fucked up freeways.** *(and also vote for Gregiore)"
non-insult,One method I use to get out of bed is to set my clock later than the actual time. So when I wake up in the morning my morning-self thinks I'm late getting up and it forces me out of bed. TL;DR Fool your morning-self into getting up by putting your clock an hour or so forward.
non-insult,Not if you are using jelly. Jelly is very solid and it shouldn't be a problem. Scoop around the edges and dollop onto the bread or gently flick onto the bread. Smooth out w/ underside of spoon. Jam on the other hand can be a problem as it is more fluid than jam and will stick. So get a heaping spoonful (the kind your mother would bitch and moan over) and drop it on then place spoon in mouth. Clean spoon nice sandwich/toast/etc. Be on your way.
neither,"F3/F:NV, 360 version, inventory management tip of doom. *Triggers can be used to quickly 'scroll through' the item number counter, in inventory.* Don't know what I mean? Try and give a companion only a couple hundred of your 5000 rounds of a particular type of ammo. Or try and sell just a few of anything you have like, hundreds of... Are you now having fun holding the damn left stick to the left for ten minutes straight, to reduce to 'give/take' amount number down from 5000 to 100, one number at a time? YOU FOOL. Click your left trigger and thank me. YOU ARE VERY WELCOME. Works in both F3 and F:NV. I played through F3 twice before I knew it, though."
non-insult,"this is less important than the ""Fucking-Pussy Effect"""
non-insult,"There is a REASON Coolbot has specifications. The Johnsons Controls tstat might work. I'm not going to research it because the thing is $80+ and the window unit OP was considering on Craigslist was only $200. The LG Electronics 18,000 BTU Window Air Conditioner with Remote Model # LW1810ER Internet # 202073150 At Home Depot is $399. Obviously the tstat would make the overall solution close in price to the recommended spec anyway. Johnson Controls is a BITCH to deal with for support, etc."
non-insult,I'm gonna send that bitch some clever rebellious romance. Bitches love clever rebellious romance.
neither,I've always been a bit disturbed by that line in the song. Creepy bastard.
insult,"Oh yea, usa foreign policy is perfect one, look at them, they didn't even attack Iran because they were ask by some oil islamic dictator... and you obviously didn't watch the video you prick, go to 52min 30s"
non-insult,"I'm guessing you have slept properly in the last month? But yea even so my design teacher is a nutcase, tell's me I'm gonna get a A all year then I end up getting a U which means ungraded (under 30%) hence I'm re-sitting this year"
neither,"I still think that's sexism. That line of thinking can lead to ""Oh, she deserved to be raped because she dressed like a slut"". So what if she dresses skimpily?"
non-insult,"You sound like a reasonable man so I doubt you would fall into this category, but... Being in my 20's I've noticed some men in their 50's tend to turn into jerks quicker than necessary when dealing with guys in their 20's. Do you notice a little bitterness between the generations? Do you think there is a ""don't tell me what to do, you're not my Dad"" vs. ""you don't know nothing yet / I sort of wish I was young again"" battle of attitudes?"
non-insult,"I really don't find that at all. I mean yeah, there are some assholes, but such is life. I think when it really comes down to stuff reddit is an amazing, caring, and generous community who will do their best to help people in any way possible."
insult,"Nope. Seems she had an ex that smoked ALL the time and passed out on top of her a few times (lovely for her to paint that picture for me). So, she didn't want it to interfere in our lives. But I continued to smoke behind her back. Irony is, she eventually snapped, strangled me and kicked the shit out of me with her spiked heals (still on her feet) while cruising down the highway. Ended with me in the hospital, then jail for suspected DUI, which was later cleared costing $4500, and her in jail for felony assault (and out of my life). Fun times... So I ask you, which one of the two interfered in our life? Crazy bitch."
insult,What do you expect? Nothing but atheist assholes in the reddit community.
non-insult,"The internet gives the ego a unique opportunity to show its face without repercussion. It really truly is as simple as ""putting out someone's light to make your burn brighter"" just like we learned in elementary school. People fool themselves into thinking they're above this by saying ""I don't care what the internet thinks, I'm not trying to make myself look cool to them."" Well, you're trying to make yourself look cool to yourself. And it's sad."
neither,"Point taken and appreciate the criticism (especially grammatical). I'll admit I went a bit overboard concerning macro forces that simplify a world view that is far more complex and that really didn't have anything to do with what Dreyfuss was talking about, but I wasn't putting Dreyfuss on a pedestal because he is famous. I know exactly where you're coming from in terms of celebrity worship and I am disgusted as well. I genuinely think he's made a good point especially concerning rhetoric on ""the war on terror"" and a proper readying of our citizenry. He seems passionate to make a positive difference in the area of history/social education. I was unclearly fasecious concerning actors and leadership, Senator Al Franken holding up the ship on that front. Though most would agree that Tina Fey is smarter than Sarah Palin, the skill-sets required in politics/leadership are very different. I don't think the political right are morons I was alluding to an increase in the demonization of what is liberal. The US isn't the worst thing ever but it's made some catastrophic mistakes which can be attributed to systemic problems. There is still a chance to bounce back, but how that happens exactly is a several trillion dollar answer."
non-insult,"So what if it's a circle jerk? Every subreddit is to some extent. Atheists are quite marginalized in real life (at least in the US), so when we get together in some small corner of the internet we do tend to gush and pat each other on the back quite a bit. I don't see anything wrong with that at all."
non-insult,"I go to reddit because of the quality of content and caliber of it's community. I guess I see a lot of ""asshole"" behavior on reddit, but usually it is done with the intent of maintaining community standards. People have to learn how to act here or else get ridiculed and insulted. I'm glad we have those assholes there to keep the unwashed masses at bay."
non-insult,"Hey, I think your pussy is sticking her tongue out at me..."
non-insult,"Just one example: I posted about the North/South Korea conflict and I said something like ""I can't see us allowing war to break out there"" and had people tell me ""well you know technically THEY ARE AT WAR ALREADY"" and ""Do you know anything about the situation we ALREADY have troops there RABBLERABBLE UR STUPID""... It's like yes, I get that. But if it's been a war up until now its been a pretty pussy war. It's more like the cold war. I was talking about open warfare and it was pretty obvious by my first post that's what I meant. So yeah, someone does always know better. I'm all for having posts be truthful and complete... but do you really have to argue over semantics like that? A lot of redditors do this and it's **very** annoying."
non-insult,"People who say ""you're being too sensitive"" don't get it at all. It's not about being sensitive or not. It's that having any view that's contrary to a knee-jerk hive mentality is going to be down voted into oblivion. Regardless of whether it is informed, insightful, or not. And the down-voting karma BS doesn't matter. It's that most people aren't going to even get to *read* these alternative ideals because they're been down-voted beyond filter."
neither,kids these days are growing up knowing not to worship pussy but instead know that it is something to be bartered for. any of you bitching about it are just jealous
non-insult,"To be fair, there are precious few that are genuinely good, friendly communities. A certain well-known liberal comedy blog is the only one I'm aware of. Last time I checked, the JREF forums were marginal, but I haven't been 'round in years. I'd say if 75% of your contributions are from regulars, you're probably good. Users need to establish some kind of identity, rather than being just a bunch of random drive-by assholes."
neither,"Oh yeah? I stopped believing kids when I heard one say ""The plural of anecdote is not data"". Then I smacked the little bastard for rubbishing my anecdotes."
non-insult,">It also teaches them not to do it next time. . . Violence isn't the only way to provide someone that lesson, nor is it the most effective. While it may be the most satisfying way for you to defend yourself, it's not the most noble. >It shows that they were fools for attacking you. It wasn't a consensual fight. And you a fool for striking them back in anger. It becomes a consensual fight once both parties have something to prove. As you said, you're a man and you're going to win that fight. >The aggressor gets what he or she gets and deserves no quarter or sympathy from anyone. This lacks context. I don't see how you can automatically castigate someone for attacking you, regardless of the reason, yet defend your right to attack them back. I don't see the world in black and white, and I don't think you do either."
non-insult,">I'm not sure who these slut-haters are or whether they even really exist outside of the church. They exist outside the church to be sure. A lot of them are other women, most of them are painfully average in regards to intellect- those of them that are intelligent obviously have other underlying issues."
non-insult,There are jerks here?
insult,"Cynics never are. Deal with it, bitch."
non-insult,Boycotts don't work because of assholes who think boycotts don't work.
non-insult,"Yikes. Firstly hats off to you. You have balls. I like the example you used at the end. I'd also be sure to ask them why they don't believe in Zeus or Thor and tell them they would had they been born a few thousand years ago etc. It's a good one. But most of all, I'd keep your GOAL in mind. Be nice, they already think that atheists are assholes, don't let them stereotype you. If you can convince a few people that ""Hey, they're an atheist and actually not evil"" then they'll start to come out of the trenches and one day maybe even close enough to hear reason."
insult,"WOW, big, mean bitch, not little nor tiny."
insult,They aren't the only ones using those same type bait-and-switch ads. I ignore them now. Stupid fuckers don't realize how many click-thru's they could get if they were just honest about it.
non-insult,"You're argument is weak and a matter of opinion. Lest you forget the vibrant colors, and the some-what original take on the the link look. I would say it's cartoon, and not just anime. Don't pigeon-hole they guy like that. In general, I'd say you are pretty damn good at this talk shit over the internets, but why not go to his site and bitch to him? For me, it was almost like someone pressed pause on the DVD or whatever. I thought it was a cool effect that it looked like animation cels. Maybe I should tell him that. You over analyzed the drawings, and Sagat_Wins wins...."
